<?xml version="1.0" encoding="UTF-8" standalone="no"?>
<!DOCTYPE etapa SYSTEM "etapa.dtd">


<etapa>

  <nombre>Cortegana - La Rábida. Palos de la Frontera</nombre>

  <numeroEtapa>16</numeroEtapa>

  <longitud unidad="km">181.1</longitud>

  <fecha>08-09-2026</fecha>

  <tiempoGanador>03:56:33</tiempoGanador>

  <velocidadMedia unidad="km/h">45,93</velocidadMedia>

  <desnivel unidad="m">2256</desnivel>

  <lugarSalida>Cortegana (Huelva)</lugarSalida>

  <lugarMeta>La Rábida, Palos de la Frontera (Huelva)</lugarMeta>

  <tipoEtapa valor="llana"/>

  <referencias>
    <referencia>https://www.lavuelta.es/es/etapa-16</referencia>
    <referencia>https://www.procyclingstats.com/race/vuelta-a-espana/2026/stage-16/result/result</referencia>
    <referencia>https://www.eurosport.es/ciclismo/vuelta-a-espana/2026/16a-etapa-perfil-recorrido-cortegana-rabida-palos-de-la-frontera-181-kilometros-horario-como-ver-television-streaming-hoy_sto23334749/story.shtml</referencia>
    <referencia>https://www.clarosports.com/ciclismo/vuelta-a-espana-2026-en-vivo-resultados-al-momento-posiciones-y-quien-gana-la-etapa-16/</referencia>
  </referencias>

  <galeriaFotos>
    <foto archivo="Salida-Cortegana.jpg" descripcion="Salida de la etapa en Cortegana"/>
    <foto archivo="Sprint-Villarrasa.jpg" descripcion="Paso por el esprint intermedio de Villarrasa"/>
    <foto archivo="Meta-LaRabida.jpg" descripcion="Llegada a La Rábida, Palos de la Frontera"/>
  </galeriaFotos>

  <galeriaVideos>
    <video archivo="Resumen-Etapa16.mp4" descripcion="Resumen oficial de la etapa 16"/>
    <video archivo="UltimoKm-Etapa16.mp4" descripcion="Último kilómetro y esprint final"/>
  </galeriaVideos>

  <galeriaPodcasts>
    <podcast archivo="Podcast-Etapa16.mp3" descripcion="Análisis de la etapa 16"/>
  </galeriaPodcasts>


  <coordenadasSalida>
    <longitudGeo unidad="grados decimales">-6.4921</longitudGeo>
    <latitud unidad="grados decimales">37.5450</latitud>
    <altitud unidad="m">638</altitud>
  </coordenadasSalida>


  <coordenadasMeta>
    <longitudGeo unidad="grados decimales">-6.9233</longitudGeo>
    <latitud unidad="grados decimales">37.2015</latitud>
    <altitud unidad="m">8</altitud>
  </coordenadasMeta>

  <hitos>
    <sprint tipo="intermedio">
      <lugar>Villarrasa</lugar>
      <coordenadas>
        <longitudGeo unidad="grados decimales">-6.5833</longitudGeo>
        <latitud unidad="grados decimales">37.3667</latitud>
        <altitud unidad="m">73</altitud>
      </coordenadas>
      <distanciaSalida unidad="km">114.5</distanciaSalida>
    </sprint>

    <puntoAnonimo nombre="Fuenteheridos">
      <coordenadas>
        <longitudGeo unidad="grados decimales">-6.6417</longitudGeo>
        <latitud unidad="grados decimales">37.8974</latitud>
        <altitud unidad="m">733</altitud>
      </coordenadas>
      <distanciaSalida unidad="km">21.9</distanciaSalida>
    </puntoAnonimo>

    <puntoAnonimo nombre="Aracena">
      <coordenadas>
        <longitudGeo unidad="grados decimales">-6.5570</longitudGeo>
        <latitud unidad="grados decimales">37.8926</latitud>
        <altitud unidad="m">714</altitud>
      </coordenadas>
      <distanciaSalida unidad="km">31.4</distanciaSalida>
    </puntoAnonimo>

    <puntoAnonimo nombre="Minas de Riotinto">
      <coordenadas>
        <longitudGeo unidad="grados decimales">-6.5833</longitudGeo>
        <latitud unidad="grados decimales">37.7000</latitud>
        <altitud unidad="m">422</altitud>
      </coordenadas>
      <distanciaSalida unidad="km">63.1</distanciaSalida>
    </puntoAnonimo>

    <puntoAnonimo nombre="La Palma del Condado">
      <coordenadas>
        <longitudGeo unidad="grados decimales">-6.5507</longitudGeo>
        <latitud unidad="grados decimales">37.3903</latitud>
        <altitud unidad="m">81</altitud>
      </coordenadas>
      <distanciaSalida unidad="km">111.0</distanciaSalida>
    </puntoAnonimo>

    <puntoAnonimo nombre="Lucena del Puerto">
      <coordenadas>
        <longitudGeo unidad="grados decimales">-6.6667</longitudGeo>
        <latitud unidad="grados decimales">37.2667</latitud>
        <altitud unidad="m">89</altitud>
      </coordenadas>
      <distanciaSalida unidad="km">136.0</distanciaSalida>
    </puntoAnonimo>

    <puntoAnonimo nombre="Moguer">
      <coordenadas>
        <longitudGeo unidad="grados decimales">-6.8388</longitudGeo>
        <latitud unidad="grados decimales">37.2758</latitud>
        <altitud unidad="m">56</altitud>
      </coordenadas>
      <distanciaSalida unidad="km">147.2</distanciaSalida>
    </puntoAnonimo>

    <puntoAnonimo nombre="Palos de la Frontera">
      <coordenadas>
        <longitudGeo unidad="grados decimales">-6.8930</longitudGeo>
        <latitud unidad="grados decimales">37.2306</latitud>
        <altitud unidad="m">10</altitud>
      </coordenadas>
      <distanciaSalida unidad="km">155.4</distanciaSalida>
    </puntoAnonimo>

  </hitos>

  <clasificacionEtapa>
    <corredorEtapa posicion="1">
      <nombreCorredor>Matthew Brennan</nombreCorredor>
      <equipo>Team Visma | Lease a Bike</equipo>
      <diferencia>0s</diferencia>
    </corredorEtapa>

    <corredorEtapa posicion="2">
      <nombreCorredor>Bryan Coquard</nombreCorredor>
      <equipo>Cofidis</equipo>
      <diferencia>m.t.</diferencia>
    </corredorEtapa>

    <corredorEtapa posicion="3">
      <nombreCorredor>Vito Braet</nombreCorredor>
      <equipo>Lotto Intermarché</equipo>
      <diferencia>m.t.</diferencia>
    </corredorEtapa>

  </clasificacionEtapa>

  <clasificacionGeneral>
    <corredorGeneral posicion="1">
      <nombreCorredor>Enric Mas</nombreCorredor>
      <equipo>Movistar Team</equipo>
      <diferencia>líder</diferencia>
    </corredorGeneral>

    <corredorGeneral posicion="2">
      <nombreCorredor>Felix Gall</nombreCorredor>
      <equipo>Decathlon CMA CGM</equipo>
      <diferencia>+2'06"</diferencia>
    </corredorGeneral>

    <corredorGeneral posicion="3">
      <nombreCorredor>Primoz Roglic</nombreCorredor>
      <equipo>Bahrain-Victorious</equipo>
      <diferencia>+2'10"</diferencia>
    </corredorGeneral>

  </clasificacionGeneral>

  <clasificacionEquipos>
    <equipoClasificado posicion="1">
      <nombreEquipo>Decathlon CMA CGM</nombreEquipo>
      <diferencia>líder</diferencia>
    </equipoClasificado>

    <equipoClasificado posicion="2">
      <nombreEquipo>XDS-Astana Team</nombreEquipo>
      <diferencia>+57'32"</diferencia>
    </equipoClasificado>

    <equipoClasificado posicion="3">
      <nombreEquipo>Red Bull-BORA-hansgrohe</nombreEquipo>
      <diferencia>+1h 11'15"</diferencia>
    </equipoClasificado>
  </clasificacionEquipos>

</etapa>
